text,rating
"Ryan, top Republicans urge caution on post-Orlando gun control measures.  House Speaker Paul Ryan and other top Republicans pushed back Thursday on growing calls from Democrats to ban people on terror watch lists from buying guns, even as Donald Trump and other GOP figures opened the door to discussing it. Calls for action have increased in the wake of the terror massacre at Pulse nightclub in Orlando that left 50 people, including the gunman, dead on Sunday. The gunman, Omar Mateen, had been on a watch list for 10 months before being removed. “We want to make sure that something like this doesn’t happen again. Everybody wants that,” Ryan told reporters Thursday. ”But as we look at how to proceed, we also want to make sure that we’re not infringing upon people’s legitimate constitutional rights. That’s important. ”  Ryan’s comments come a day after Trump indicated potential support for new gun laws in this area.  “I will be meeting with the N. R. A. who has endorsed me, about not allowing people on the terrorist watch list, or the   list, to buy guns,” the presumptive GOP presidential nominee tweeted Wednesday. Whether Trump would support an outright ban or just a delay for gun sales for those on watch lists is not clear. That is the sticking point right now in the Senate.  Sen. Dianne Feinstein,  . and other Democrats are pushing a measure to ban those on   lists from purchasing weapons.   But Republicans worry about such a measure infringing on gun rights for someone wrongly included on such a list.  Sen. John Cornyn,   has a dueling measure to delay a gun sale for 72 hours, but require prosecutors to go to court to show probable cause if they want to block the sale permanently. Cornyn’s bill has been backed by the NRA. Meanwhile, Republican Sens. Charles Grassley, of Iowa, and Ted Cruz, of Texas, have a measure that would notify law enforcement if anyone investigated for terrorism in the last five years tries to buy a gun    in addition to making other changes.  Democrats drew more attention to their version of the legislation Wednesday night as Sen. Chris Murphy,  . held the floor along with colleagues in a nearly   filibuster that lasted into the early hours Thursday.  ”We can’t just wait, we have to make something happen,” said Sen. Cory Booker,  . J. at an emotional news conference where Democrats joined family members of people killed in the nation’s recent mass shootings. ”These are people bound by brutality, and their numbers are growing.” But Majority Leader Mitch McConnell,  . blasted Murphy’s filibuster as a ”campaign   ” that did nothing but delay potential votes. Cruz also slammed Democrats, saying on the Senate floor the Democrat effort was nothing more than a political distraction that avoided the real issues. “I find it ridiculous that in response to an ISIS terror attack, the Democrats go on high dudgeon that we’ve got to restrict the Second Amendment rights of   citizens,” Cruz said. “This is not a gun control issue, this is a terrorism issue. ” Sen. Chuck Schumer,  . Y. called Cornyn’s bill a ”wolf in sheep’s clothing” and said it would allow ”every terrorist to get a gun.” Clinton’s spokesman, Brian Fallon, called Cornyn’s bill a ”smokescreen.” Cornyn responded angrily. ”That’s an incredibly ignorant thing for her to say,” Cornyn said. ”That anybody can be denied their constitutional rights without due process of law and without the government coming forward and establishing probable cause, that’s simply  .” A possible bipartisan compromise was proposed by Sen. Pat Toomey,  . Toomey said Wednesday his bill would prevent potential terrorists from getting a gun, while providing an extra layer of due process that the Democratic bill lacks. “I have drafted legislation that takes the best features from both of the previous proposals, effectively preventing terrorists from being able to purchase guns, while also safeguarding the rights of innocent Americans who are mistakenly put on the list,” Toomey said. Meanwhile, the Justice Department backed a ban on gun sales to those on watch lists.  “The amendment gives the Justice Department an important additional tool to prevent the sale of guns to suspected terrorists by licensed firearms dealers while ensuring protection of the department’s operational and investigative sensitivities,” a DOJ official said in a statement.  The DOJ’s stance is a departure from past warnings from FBI Director James Comey, who reportedly has said a ban could alert terrorists they are being investigated.  Ryan cited those remarks when talking to reporters. “As the FBI director just told us the other day, and I think he said this publicly, if we do this wrong, like the president is proposing, we can actually blow our ongoing terrorist investigations. So, we want to get this right, so that we don’t undermine terrorist investigations,” Ryan said. The Associated Press contributed to this report.   ",1.0
"Mattis threatens Nato with reduced US support over defence spending. The new US defence secretary has delivered an ultimatum to Nato allies, saying they must either honour military spending pledges or face the prospect of America “moderating” its commitment to the transatlantic organisation. James Mattis issued the warning to the other 27 members of the alliance on Wednesday during a closed session at Nato headquarters in Brussels on his first visit to Europe as a senior member of Donald Trump’s cabinet. Mattis’s predecessors have made similar threats over the last decade during visits to Nato, but without the same conviction. “I owe it to you to give you clarity on the political reality in the United States, and to state the fair demand from my country’s people in concrete terms,” he said. “America will meet its responsibilities, but if your nations do not want to see America moderate its commitment to this alliance, each of your capitals needs to show support for our common defence. ” Trump repeatedly said on the campaign trail last year that it was time for European countries to stump up a fair share for an organisation he denounced as “obsolete”. He created alarm among other Nato members when he said the US might not automatically come to the defence of a fellow member under attack. Only five of the 28 members meet Nato’s target of spending at least 2% of GDP on defence: the US, the UK, Poland, Greece and Estonia. The US spends 3. 6% on defence and the UK 2. 2% based on Nato figures for 2016, while Germany spends 1. 1% France 1. 7% Italy 1. 1% and Spain 0. 9%. Mattis did not spell out what he meant by “moderating” support.  The Obama administration, in response to Russia’s annexation of Crimea in 2014, reversed US troop withdrawals from Europe and began the biggest deployment since the end of the cold war, with the first of 4, 000 extra troops arriving in Poland in January.  On Wednesday Mattis said he wanted Nato to adopt a plan with new target dates for meeting at least the 2% target and that the plan should be in place by next year.  Earlier he expressed support for the alliance, saying it was a “fundamental bedrock” of US defence policy. Against a backdrop of fresh scrutiny over the new US administration’s alleged links to Russia, he claimed this support was backed by his boss, saying Trump had “strong support for Nato”.  But Mattis also told the meeting of defence ministers: “No longer can the American taxpayer carry a disproportionate share of the defence of western values. Americans cannot care more for your children’s future security than you do. ” Mattis tried to make his case by citing the threat from Moscow, noting the annexation of Crimea and Islamic State’s hold over parts of Iraq and Syria, and saying that “some in this alliance have looked away in denial of what is happening”. “Despite the threats from the east and south, we have failed to fill gaps in our Nato response force or to adapt,” he added. Mattis will attend the Munich security conference at the weekend on a visit that will offer another opportunity for European defence and security ministers to try to gauge the Trump administration’s plans. On the campaign trail Trump repeatedly claimed that the US was paying 75%of Nato’s costs because European countries, struggling with domestic spending problems, were unwilling to contribute their share.  Although the US and UK use the yardstick of 2% of GDP, the running costs of Nato shared by all 28 members in 2016 amounted to about $2bn (£1. 6bn). While the US was the biggest contributor, this amounted to significantly less than Trump’s claimed 75%. The US paid 22% of the common running costs, Germany 14. 6% France 10. 6% and Spain 5. 7%.  The UK defence secretary, Michael Fallon, who was at the meeting and supports the push for other countries to raise defence spending to 2% said Mattis had explained that “the impatience of the American taxpayer is a reality”. On Tuesday, the International Institute for Strategic Studies thinktank said in its annual military balance report that UK defence spending had fallen to 1. 98% in 2016. The UK Ministry of Defence disputed this.",-0.5
"Australian property prices are cooling and household debt is high, but that's no problem: HSBC. Aussies have some of the world's highest debt levels, and property prices are finally cooling. But investors fearing a U.S-style credit crisis needn't worry, according to a new report from HSBC. As Canberra reoriented economic growth away from mining and towards services, a housing construction boom began, leading to a 30 percent increase in home prices since mid-2012 and making Australia one of the world's least affordable property markets. As a result, the household debt-to-income ratio jumped from 167 percent in 2011 to 186 percent in 2015, HSBC said. ""This makes Australian household debt levels amongst the highest in the developed world."" The rise in home prices slightly softened the household debt-to-asset ratio, which fell from 24 percent in 2011 to 22 percent in 2015. But as the market beings to cool, that raises questions about the sustainability of household debt, the bank said. National housing prices have been steady over the past six months, with the slowdown most reflected in major cities. In Sydney and Melbourne, prices have been flat since October, following annual average growth of 10 and 6 percent respectively, over the previous four years, HSBC noted. The bank forecasts national housing price growth to run at low single-digit rates this year and into 2017, following growth of about 10 percent in 2015, on the back of over-supply. That could increase the household debt-to-asset ratio, leaving residents vulnerable to external shocks. But Australia's case is manageable because it has good distribution of debt, unlike the U.S. pre-global financial crisis, HSBC explained. ""It is unusual for the high debt levels, in themselves, to be the driver of a downturn... Importantly though, even in the U.S., it was not the level of aggregate debt that mattered most, but the distribution of debt."" The bulk of Australian debt is held by higher income households, with 2010 data revealing 72 percent of household debt was held by the top 40 percent of income earners, HSBC said. The lowest 20 percent of earners held less than 4 percent of the debt, it added. Moreover, Australia's financial system has institutional features that help to reduce any risk of a crisis. ""For a start, all mortgages are full recourse. Australia's tax system also favors paying down mortgages ahead of schedule as interest payments and expenses on owner-occupied properties are not tax-deductible,"" HSBC said. Full recourse means that lenders can pursue a debtor's other assets to cover a loss on a loan, rather than having to write off losses on underwater loans, as occurred in many U.S. states during the credit crisis. ""The average mortgage is currently over 2.5 years pre-paid, leaving households with a significant buffer in the face of the risk of rising unemployment,"" it added. Strict lending rules have also been helpful in creating stable loan portfolios. Banks are now required to slow the growth of lending to property investors to below 10 percent on-year, test new borrowers for a higher mortgage rate than offered and hold more capital. ""These tighter prudential settings have seen a clear pullback in lending to investors,"" HSBC observed, indicating these new rules could curtail future debt levels. —Follow CNBC International on and Facebook.",0.0
"Our ability to make random, “creative” choices peaks at 25. Our ability to make random choices, which are tied to bursts of creativity, peaks at the age of 25, researchers report in a new study. Why it matters: Random decision-making is a hallmark of human cognition. Scientists have known that our ability to make choices or behave without an apparent method diminishes with age but they don't know when that capacity peaks, which may inform our understanding of Alzheimer's and other neurodegenerative diseases. The details: 3,400 people aged 4 to 91 years old completed a series of online tasks that asked them to create random patterns and sequences: Participants chose hypothetical results for 12 coin flips. Five cards were presented and people in the study chose which one they thought would be at the top of the deck. They did this 10 times. People taking part were instructed to imagine rolling one die 10 times and to click on a number between one and six as randomly as possible so that if another person is shown the sequence, he or she wouldn't be able to tell whether numbers were produced by actually rolling a die or made up by somebody. They clicked 10 times in a random fashion on nine dots. Participants were instructed to make a random pattern with 9 in a grid. Using an algorithm that ranked randomness and controlling for characteristics like gender, language and education levels, the researchers found the ability to act randomly peaked at age 25, on average, and declined from there.",0.0
"Snapchat parent company files for IPO | TheHill. Snap Inc., the parent company of mobile app Snapchat, officially filed for an initial public offering (IPO) on Thursday afternoon. The highly anticipated IPO will be the biggest since Alibaba’s $25 billion dollar filing in 2014, which was the largest ever. Experts expect the Snap IPO’s valuation to be in the range of $20 billion to $25 billion. Some outlets are reporting estimates as high as $35 billion. The company used its filing Thursday to raise major political issues, including U.S. tax reform. “Certain changes to U.S. tax laws ... could affect the tax treatment of our foreign earnings, as well as cash and cash-equivalent balances we maintain outside the United States,"" Snap wrote under the risk factors portion of their SEC filing. “Due to the large and expanding scale of our international business activities, any changes in the U.S. or foreign taxation of such activities may increase our worldwide effective tax rate and the amount of taxes we pay and seriously harm our business."" Tax reform has been a concern for many in the tech industry, with tech leaders calling it a priority for discussion when entering a meeting with Donald TrumpDonald John TrumpTrump pushes back on recent polling data, says internal numbers are 'strongest we've had so far' Illinois state lawmaker apologizes for photos depicting mock assassination of Trump Scaramucci assembling team of former Cabinet members to speak out against Trump MORE, then the president-elect, in December. Apple CEO Tim Cook also met with lawmakers in January to discuss tax policy, among other topics. Snap also raised the Brexit as another concern in its filing Thursday, saying the United Kingdom's decision to leave the European Union could “seriously harm"" its business. “The political and economic instability created by Brexit has caused and may continue to cause significant volatility in global financial markets and uncertainty regarding the regulation of data protection in the United Kingdom,” the filing read. The company opened its first European office in London earlier in the month. According to the Thursday filing, Morgan Stanley is the lead underwriter, alongside Goldman Sachs, J.P. Morgan, Deutsche Bank, Barclays, Credit Suisse and Allen & Company. Snap will only offer Class A shares in the offering, which don’t have shareholder votes. The move is in step with many large tech companies taking precautions to retain high levels of control after going public. Facebook’s shares are structured in a manner that protects founder and CEO Mark Zuckerberg’s stake in the company. Google made similar provisions in its 2004 IPO. Snap's SEC filing did not specify the number of shares that would be issued and shares will not pay dividends. Updated at 5:57 p.m. View the discussion thread. The Hill 1625 K Street, NW Suite 900 Washington DC 20006 | 202-628-8500 tel | 202-628-8503 fax The contents of this site are ©2019 Capitol Hill Publishing Corp., a subsidiary of News Communications, Inc.",0.0
"Supreme Court orders closer look at credit card surcharge laws | TheHill. The Supreme Court on Wednesday unanimously ordered a lower court to take another look at laws that ban merchants from describing the higher price they charge when customers pay with a credit card instead of cash as a “credit card surcharge.” Under the law in New York and other states, merchants must describe the difference as a “cash discount.” In delivering the opinion of the court, Chief Justice John Roberts said the the law regulates speech, as the merchants argued it did, but sent the case back to the 2nd Circuit Court of Appeals to decide whether it is unconstitutional.  “Each time one of their customers pays with a credit card, these merchants must pay some transaction fee to the company that issued the credit card. The fee is generally two to three percent of the purchase price,” Roberts explained in his opinion. “Those fees add up, and the merchants allege that they pay tens of thousands of dollars every year to credit card companies. Rather than increase prices across the board to absorb those costs, the merchants want to pass the fees along only to their customers who choose to use credit cards. They also want to make clear that they are not the bad guys — that the credit card companies, not the merchants, are responsible for the higher prices.” View the discussion thread. The Hill 1625 K Street, NW Suite 900 Washington DC 20006 | 202-628-8500 tel | 202-628-8503 fax The contents of this site are ©2019 Capitol Hill Publishing Corp., a subsidiary of News Communications, Inc.",0.0
"New OMB director can help improve government efficiency | TheHill. President-elect Donald TrumpDonald John TrumpTrump pushes back on recent polling data, says internal numbers are 'strongest we've had so far' Illinois state lawmaker apologizes for photos depicting mock assassination of Trump Scaramucci assembling team of former Cabinet members to speak out against Trump MORE’s decision to name conservative budget hawk Rep. Mick Mulvaney (R-S.C.) director of the Office of Management and Budget is a signal that the new administration will emphasize lower government spending despite plans for sizable tax cuts and a major infrastructure program. This ambitious agenda no doubt will consume the lion’s share of the new director’s time. But, as he helps craft a new budget and grapples with fiscal policy, Mulvaney and the new president should embrace the other critical roles played by OMB that could have a huge impact on the operations of the government. OMB is a small agency — fewer than 500 employees — but its reach spans across the federal landscape. It is the only entity positioned to drive innovation, collaboration, efficiency and the use of data throughout the federal enterprise. With the potential of smaller budgets, improved management and cost-effective delivery of services will be essential. As history has demonstrated, competent management can lead to positive outcomes and a successful presidency. Missteps can derail important initiatives, lead to political fallout and increase public distrust. While the departments and agencies must be responsible for implementing policies, there are a number of areas where Trump and Mulvaney can expand current practices to greatly improve government performance, better serve the public and help themselves in the process. First, OMB should play a stronger role strengthening how government uses information and evidence to better understand whether programs and policies are getting positive results. Too often, agencies spend money based on good intentions and “guesstimates,” not on measurable evidence that programs are working as intended. OMB could help set standards for what constitutes success and identify which programs and approaches meet those standards. Second, OMB should be more proactive in removing barriers that impede change and innovation. Solving tough problems requires taking chances and that means a greater tolerance for well-founded risk-taking.  While OMB has a reputation for being ""the agency of no” because of its role protecting the president and the administration’s budget and policy priorities, it can do more to clarify where agency leaders have flexibility to test new approaches, identify areas that are off-limits, provide air cover to test new ideas without fear of reprisals and serve as an incubator for change. The Obama administration, for example, created a template for innovation by starting the United States Digital Service inside OMB, bringing in private sector technology experts to work with federal employees to improve agency online services and internal operations. OMB then helped spread this successful digital services startup model to other agencies. Third, OMB should build on current efforts to get agencies to work more closely together on many of the nation’s critical challenges. Few of the issues, such as cybersecurity, economic development, or immigration, can be solved by any single agency acting alone. Achieving many of the new administration’s priorities will require having the government operate as an integrated enterprise, rather than separate, disconnected entities. OMB could work with Congress to fund cooperative interagency efforts and help agency leaders connect and map strategies to align overlapping activities. An example of current of OMB-assisted, cross-agency coordination involves expediting the federal permitting, review and approval processes for more than 50 infrastructure projects. This has involved efforts by multiple agencies, including the Environmental Protection Agency, the Department of Transportation and the Army Corps of Engineers, to synchronize their work. In the state of New York, the federal permitting and review process for the replacement of the Tappan Zee Bridge took 1.5 years, instead of the normal three-to-five years, because of the federal coordination. While the budget will always be OMB’s most significant function, Mulvaney and Trump will have the challenge and opportunity to expand OMB’s role as a positive force in helping agencies more effectively deliver results for the American people.   Max Stier is president and CEO of the nonprofit, nonpartisan Partnership for Public Service, which through its Center for Presidential Transition, has worked with the presidential candidates, federal agencies, Congress and the White House to help ensure the next chief executive is prepared to govern. A graduate of Yale University and Stanford Law School, Max is a member of the National Academy of Public Administration, the Administrative Conference of the United States and the National Advisory Board for Public Service at Harvard College.     The views expressed by contributors are their own and not the views of The Hill.  View the discussion thread. Contributor's Signup The Hill 1625 K Street, NW Suite 900 Washington DC 20006 | 202-628-8500 tel | 202-628-8503 fax The contents of this site are ©2019 Capitol Hill Publishing Corp., a subsidiary of News Communications, Inc.",0.0
