text,rating
"Ted Cruz: ‘Attacks’ From Donald Trump ‘Henchmen’ Are ‘Garbage’ - Breitbart. 2016 Presidential contender Ted Cruz is accusing Donald Trump of playing a part in accusations of infidelity launched against the Texas senator in the National Enquirer. [Ted Cruz posted to Facebook on Friday:  I want to be crystal clear: these attacks are garbage. For Donald J. Trump to enlist his friends at the National Enquirer and his political henchmen to do his bidding shows you that there is no low Donald won’t go. These smears are completely false, they’re offensive to Heidi and me, they’re offensive to our daughters, and they’re offensive to everyone Donald continues to personally attack. Donald Trump’s consistently disgraceful behavior is beneath the office we are seeking and we are not going to follow. The National Enquirer piece cited an anonymous source and accused Cruz of multiple extramarital affairs. Cruz pointed out in a Friday morning press conference that the gossip magazine piece ran the day after Trump’s accusation against Cruz for the Make America Awesome PAC ad including the Melania Trump modeling photo. Roger Stone told USA Today via email: Everything I know about these allegations I heard from credible reporters for the MSM  …    I played no role in the placement of the story. Trump and Cruz have been locked in a battle over their wives since a   Super PAC ran an ad with partially nude modeling photos of Trump’s wife Melania aimed at Utah Mormon women. Trump accused Cruz of running the photo. Breitbart News reported on the exchange between the two top Republican presidential contenders that led Cruz to tell reporters on Thursday: “It’s not easy to tick me off. I don’t get angry often, but you mess with my wife, you mess with my kids, that’ll do it every time. Donald you’re a sniveling coward and leave Heidi the hell alone. ” Follow Michelle Moons on Twitter @MichelleDiana ",1.0
"How BioShock Mocked Video-Game Morality.         For us to continue writing great stories, we need to display ads.             Please select the extension that is blocking ads.     Please follow the steps below, Near the beginning of the groundbreaking video game BioShock, the player is forced to make what seems like a crucial moral decision: You liberate a   child who has been tormenting the local populace, and are told you can either kill it for a huge reward, or let it go free, but gain far less in the process. BioShock is filled with these moments —     choices that seemingly add to a larger ethical experience for the user in a departure from the usually   nature of playing video games. Upon its 2007 release, BioShock felt like a revolution, or at least the start of one. The complexity of its   approach was basic to say the least the game only branched into two endings. Nine years after its initial release, BioShock is now available in a remastered,   edition with its sequels —  three games in total that proclaimed to allow players to examine their own values as they ventured through dark, fantastic worlds. The idea of multiple moral paths to a player’s story became a fad that video games are still struggling to incorporate, and BioShock: The Collection shows both the appeal, and the necessary limitations, of the ideas the original game generated. BioShock wasn’t the first of its kind to offer users an array plot outcomes, based on how they behaved while playing. Advanced   games like BioWare’s Knights of the Old Republic, set in the Star Wars universe, would categorize the player as being on good or evil depending on how they behaved, though that only really affected the character’s appearance. But, of course, video games had largely functioned on rails for the entirety of their existence: A player’s job was to rescue the princess, to get the treasure, to destroy the bad guy, and everything in the game existed to push the player in a single direction. Date Night With the Zombies, In BioShock, the main moral conundrum is a simple one, and revolves around the game’s Little Sisters, young girls who walk around tormenting the citizens of the underwater city of Rapture. If you “Harvest” them, their life force helps power your own magic weapons if you instead heal them and send them on their merry way, you get less power, but the satisfaction of doing the right thing. Behave one way, and you get a “happy” video played at the end of the game, assuring you that your character lived a good life behave another, and the Sisters take brutal revenge on you, tearing you apart. The only huge difference was the ending  .  What made BioShock truly interesting was that while it allowed players to exercise their ethical judgment, it also cleverly acknowledged the larger reality of gaming: that players actually don’t have much choice at all (spoilers for the first game’s ending follow). As BioShock’s protagonist wanders through Rapture’s surreal underwater world, battling the crazed survivors of mass human experimentation, he’s guided by a helpful voice calling himself “Atlas. ” Atlas is a supposed rebel that’s looking to bring down Andrew Ryan, the tyrannical leader of Rapture, an Art Deco nightmare that he founded based on the principles of objectivism and the philosophies of Ayn Rand. In the end, Atlas is revealed to be the game’s true villain, a gangster trying to seize power in Rapture the player is his sleeper agent, who’s unwittingly forced to do Atlas’s bidding any time he utters the phrase “would you kindly” (which he does, often). It was a brilliant twist and the game’s way of ultimately mocking the illusion of choice it supposedly offered. Yes, there were moments along the way where you could approach situations from various angles. But BioShock understood that the medium of video games is always going to be   and the designed worlds still exist for one player to navigate a very specific story toward   endings. Play BioShock again with the twist in mind, and you catch every utterance of  “would you kindly. ” It always comes when there’s no choice at all: You have to move on to the next level, or pick up that weapon, or kill whatever big boss Atlas is pointing you at next. Yes, he leaves the decision about the Little Sisters to you, but that’s just one small element in an otherwise scripted story. It was subversively   for the time —  in 2007, BioShock was actively experimenting with the medium and the small choices it could offer the user. But its designer, Ken Levine, also wanted to make it clear that there was only so much he could do within the constraints of the medium. Two sequels, also included in BioShock: The Collection, were largely regarded as disappointments. BioShock 2 (2010) which Levin didn’t design, revisited the world of Rapture and put the player in the skin of one of its coolest monsters: the Big Daddy, a   behemoth clad in a   diving suit. Though the game embellished on some of the most appealing design elements of the first BioShock, it had much less to offer in terms of original storytelling. BioShock Infinite (2013) a “spiritual sequel” from Levine set in the new dystopia of a steampunk city in the sky, was far more ambitious. Infinite retained the moral nuance of BioShock, often presenting its users with small crises to resolve in multiple ways. But this time it had no impact on the overall ending, which was much a more convoluted, fully scripted affair involving  . After the release of BioShock,   storytelling was briefly the biggest fad in gaming, with games like Dishonored and Deus Ex: Human Revolution making it the backbone of their advertising. But designers largely struggled to integrate such choices in an interesting way. The acclaimed   series Mass Effect let its protagonist behave as a morally upright hero or a rude, selfish renegade, which could affect whether other characters lived or died as the game went on. But that series’ ending was widely criticized for being unable to close the circle: For all the supposed free will a player could exercise, there was really only one way for the game to end. Now, there’s a   of games geared toward “decision trees,” many of them produced by the innovative studio Telltale Games. This slightly soapier genre strips away much of the adventure of a     game. Telltale’s series based on The Walking Dead or Game of Thrones play like Choose Your Own Adventure books, and are essentially living graphic novels that present the user with tough decisions, rather than oncoming enemies or interactive puzzles. It’s a specific genre that has a growing fan base, but it lacks the immersive feel of a bigger, more complex gaming experience.   Near the end of BioShock, before confronting  Atlas, the player is led before Andrew Ryan, the supposed antagonist who created Rapture and saw it spin out of his control. In one of gaming’s most iconic scenes, Ryan uses the player’s trigger phrase against him, to prove some grand philosophical point: “A man chooses a slave obeys,” he barks, ordering the player to kill him. At this point, the game takes over, turning off the controls and forcing the player to do as Ryan says. Video gaming has made titanic strides in storytelling since its earliest days since the release of BioShock, the medium’s horizons have only broadened further. But nine years after its release, the most revolutionary thing about the game was how cleverly it admitted that, in some ways, it wasn’t revolutionary at all.",-0.5
"Election 2016: Knowns and Unknowns. The Disaffected. Will     establishment Republicans outnumber renewed Reagan Democrats, Tea Partiers, and conservative independents, some of whom likely sat out 2008 and 2012, but who now are likely to vote for Trump? The latter energized group will probably continue to support Trump even if he persists in his suicidal detours like the legal gymnastics of Trump University, or if he keeps repeating ad nauseam the same stale generalities he has served up throughout his campaign. And will the ranks of the #NeverTrump holdouts, despite claims to the contrary in the spring, thin by autumn, should Trump change a few of his odious spots and become a more disciplined candidate? Will his populist message be recalibrated to appeal to minorities who, albeit less publicly than their white counterparts, resent illegal immigration and its effects on the poor and working classes, are angry about record labor nonparticipation and elite boutique environmentalism, and appreciate tough, even if crazed, El Jefe talk in place of politically correct platitudes?   vs.  . Will Sanders holdouts roughly approximate the number of Republican #NeverTrumpers? For now, it would be more socially acceptable for a Sanders supporter to vote for Hillary than for an   to give in and vote for Trump. Voting for Hillary would not entail the social and class costs for a Sanders supporter that voting for Trump would for a Republican of the “   ” Romney or Jeb Bush wing. The Wall Street Journal is more likely to show repugnance for the idea of finishing the wall than an advocate of Sanders’s 70 percent top tax rate is to reject Hillary’s less radical, though radical enough, idea of upping the current 39. 5 percent top rate. An oddity of the campaign is that the Republican establishment applies a higher standard to its own candidate than it has applied to either Barack Obama or Hillary Clinton, who, with a modicum of research, can be proven to have matched Trump, slur for slur. RELATED: Did #NeverTrump Have to Happen? RELATED: The Facts Keep Undermining Hillary’s   Tales, The Obama Matrix. Pollsters are still trying to calibrate to what degree Hillary will recapture Obama’s record minority registration, turnout, and block voting  —   and whether such pandering will in turn spike the     vote to record levels. There is something foreign and uncomfortable about Hillary’s   performances perhaps her shrill obsequiousness will strike at least some minority voters as a sort of elite white and repugnant condescension. No one likes a transparent   especially by someone whose past record of honesty and character is so disreputable. Conventional wisdom suggests that the supposed “new” demography will allow Hillary to replicate the Obama coalition, but that assumes that minority voters, who supposedly vote along ethnic and racial lines, are comfortable with Hillary’s tastes and with her disingenuous career, and will vote as they did in 2008 and 2012, more than making up for new    converts to Trump. RELATED: Republicans Are Stuck with Donald Trump until November  Trump Factor X. Will the   “Trump disconnect” continue, an intangible that for over a year has humiliated pundits who have made serially erroneous forecasts of his demise? In other words, no one has yet been able to calibrate the degree to which Trump has made politics irrelevant and substituted harsh, politically incorrect, and often crude expression and rhetoric for any kind of detailed agenda. No one knows quite how the weird Trump factor that propelled him through the primaries will play in the far wider arena of the general election, but all of us have met in our own circles the most surprising and unexpected Trump supporters, who cite no resonant political affinity with Trump other than shared furor over politically correct and censored speech, and the need for someone  —   almost anyone will do  —   to throw a wrecking ball through the politically correct glass houses of our society. No one knows how many of his supporters are silent, embarrassed to state publicly their support for one so uncouth no one knows what he may say or do on any given day  —   or the full effect of his outbursts  —   and no one quite appreciates that what appears outlandish to elites may appear genuine and earthy to others. Today experts laugh that a supposedly buffoonish Sarah Palin sank the otherwise sober and judicious McCain campaign but, in truth, polls at the times suggested that she was either not a factor or perhaps a plus to the ticket. In any case, the McCain —  Palin ticket was ahead of Obama until the Wall Street meltdown in September of 2008. Elites who said they knew no one who liked Palin in truth must have known very few Americans at all. Share article on FacebookshareTweet  The Media. Trump sailed to primary victories on a Machiavellian wave of media manipulation he had   pull, and at very little cost could leverage network attention  —   either on the premise that his buffoonery was a ratings plus, or because leftist flutists were willing to play for Trump in the hopes of leading Republican lemmings over the cliff. What is certain is that in the general election, the media will revert to form and become an institutionalized extension of the Clinton campaign Trump mania will no longer be useful to either their profits or their political objectives. Then we will see just how adroit Trump is as a media showman, when journalists are out to get him rather than to be entertained by him. Moreover, the    free publicity of early 2016 may have left the Trump organization complacent, expecting that it could glide to a   victory without massive fundraising and a serious ground game. That delusion might mean that Trump’s people will never quite catch up with Hillary’s money and     machine. RELATED: There Is No Such Thing as Unbiased Journalism, So Let’s Stop Pretending, Septuagenarians. Will the health of the    Clinton and the nearly    Trump hold up under the grueling next five months of summer and autumn campaigning? Actuarial tables suggest that both would likely be able to finish out two terms, but the point is not necessarily longevity, but robustness. In other words, which of the two elderly candidates  —   in combined age, they are the oldest nominees in   history  —   will be the more likely to crisscross the country and put in   days? While Trump  —   at about the same age as the     Bill Clinton  —   does not seem to be a model of fitness, so far he exhibits an animal energy lacking in Hillary. Obama  —   on the Back Nine or on the Stump? As long as Barack Obama keeps out of sight, and things run on autopilot, half the country likes the abstract idea that he is president. In contrast, when he campaigns, demagogues, slurs, and expresses his inner narcissism, his ratings dip to near 40 percent. If he slams Trump from abroad, delivers another stuttering, incoherent rant against Trump, offers the Clintons more snarky backhanded compliments (Hillary is “likeable enough”) or issues more     executive orders, he will prove by November more a negative than a plus. For now, Hillary is flummoxed about how to win his allegiance (both political and legal) without having to defend a disastrous $11 trillion in additional debt, a mess overseas (in which, to be sure, she had a hand) Obamacare, and a sluggish economy of slow growth and record      —   or what Bill Clinton summed up succinctly as the “awful legacy of the last eight years. ” Obama could help Hillary best by giving a   endorsement and then staying on the golf course until November. If, instead, Obama goes on the stump for her, it may be counterproductive  —   and in some subliminal fashion therefore preferable for the egocentric Obama. RELATED: The Revenge of Tribalism, The News. If Putin stays within his boundaries, if the Chinese and North Koreans refrain from doing something stupid, if Iran curbs its braggadocio and does not hijack another American boat, if ISIS fails to pull off another major terrorist operation, and if the economy continues to stagger along, then the superficial calm works to Hillary’s advantage. But if in the next five months we have a foreign crisis or an economic slowdown, then Hillary in relation to Obama replays the role of McCain in relation to Bush in 2008  —   but squared, given Hillary’s tenure in the Obama administration. Obama, with massive defense cuts,    and reset diplomacy, and treating allies as neutrals and enemies as friends, has endangered America abroad and weakened it at home. The tab is coming due, but whether it will arrive before November is unclear. Certainly, the latest tragedy of the the mass shooting in Florida suggests that having a president and a   president who, for politically correct reasons, cannot utter the phrase “radical Islam” or “Islamic terrorism” in the context of Muslims who kill innocents out of religious zeal and hatred is not a sustainable proposition. RELATED: Two Establishments, Two Failures, The Rot. We do not quite know to what the degree the public is sick of the New York —  Washington rot, encompassing Obama’s petty identity politics, the Clintons’ grifter enterprises, the sanctimonious and ossified Republican establishment, the incestuous network of cable and media pundits, and the general sense that our elites of both parties never expect the consequences of their own ideologies to apply to themselves. The general repugnance for traditional politicians,   wizards, and Wall Street profiteers fueled both Sanders and Trump, despite the contradictions of their own relationships with big money, big politics, and big media. But as Sanders drops out of the race, Trump alone will remain the more populist and   of the final two candidates. The idea of socialist Sanders supporters flocking to Trump should seem wholly lunatic. But the same youthful incoherence that drew the naïve to Sanders might to some degree draw them now to Trump, on the basis that he dislikes Hillary, Inc. even more than did Sanders. The wonder (to paraphrase Dr. Johnson on female preachers and dancing dogs) is not that Trump might capture a fair number of Sanders voters, but that he could capture any at all. Final thoughts: If Trump were to win, the   establishment would be mostly discredited and the party would move even further to the Left, in McGovern 1972 fashion, while its Republican establishment counterpart would wander in a    wilderness. More 2016 It’s Time to Move On from the 2016 ElectionHillary Blames America FirstHillary Says Voter Suppression Cost Her the ElectionIf Hillary prevails, we will likely see a   continuum of fundamental change, the likes of which have not been seen since the 20 years between 1933 and 1952  —   though Obama has none of the redeeming virtues of FDR on foreign policy, nor Hillary those of Truman. Meanwhile the   among Republicans that would follow a Clinton victory (with one wing arguing that   sabotaged Trump and the other wing saying it was Neanderthals who nominated him) might well destroy the party, given that its class fissures, first revealed in the defections to the 1992 and 1996 Perot campaigns, have now become an abyss. In the meantime, perhaps #NeverTrumpers should adopt one rule for the sake of party unity: For each of their attacks on the Republican nominee, vow to match it with one attack on the Democratic nominee. And for each conservative guest editorialist in the New York Times or Washington Post deploring what the Republicans have done, perhaps a #NeverHillary liberal might write a commensurate critical   about Clinton in The Weekly Standard or National Review.  —   NRO contributor Victor Davis Hanson is a senior fellow at the Hoover Institution, and the author, most recently, of The Savior Generals. ",1.0
"5 things to know for your New Day -- Thursday, June 11.  (CNN) Those escaped convicts may be headed to Vermont. An American dies fighting ISIS in Syria. And maybe one day soon, you can get the Internet from outer space. It’s Thursday, and here are five things to know for your New Day.    NEW YORK PRISON ESCAPE, Search continues: Are the New York escapees headed to Vermont? Authorities believe they could be, hoping to evade the intense manhunt for them that’s covered upstate New York. Vermont police vessels and state troopers will conduct patrols on Lake Champlain, which sits on the New   border, and New York state troopers will be allowed into Vermont if needed. The search for Richard Matt and David Sweat now involves more than 400 officers.   ISIS, American killed: Keith Broomfield, an American citizen, was killed in Syria fighting ISIS. Broomfield was fighting alongside the Kurds. Not much more is known at this time about him, including how he died, how long he had been in the region as a fighter and just how he became a fighter.   D. C. MANSION KILLINGS, More evidence: We knew the slayings last month of a prominent Washington family and their housekeeper were gruesome, and newly unsealed court documents    a search warrant and accompanying affidavit    illustrate just how bad it was. A bloody baseball bat was found in the room where three of the bodies were found. Some of the victims suffered trauma to the head   lacerations to the throat and head.    BALTIMORE  Police talk: The city is suffering through one of the most violent periods in its history, and a pair of cops admit the police are standing by and letting it happen. The officers, who talked to CNN anonymously, said police feel abandoned by the city’s leadership and are afraid of being charged criminally for simply doing their jobs. So they are no longer aggressively pursuing the bad guys. After the interview aired, Baltimore Police Commissioner Anthony Batts urged them to think of the citizens and ”remember why you do this job.”     INTERNET, Web wonder: Want to get the Internet from space? It’s a step closer to reality, now that Elon Musk has asked the government for permission to start testing his idea for getting Web service from beyond the clouds. Musk will launch eight prototype satellites, each quipped with antennas that will send Internet signals back to Earth. The FCC is reviewing the proposal Musk would like to start testing next year.",-1.0
