text,rating
"Portland, Oregon to demand controversial Uber software tool. Uber has acknowledged using the software, known as Greyball, to circumvent government officials who were trying to clamp down on Uber in areas where its service had not yet been approved, including Portland. It has since stopped the use of the software for that purpose, saying the program was created to check ride requests to prevent fraud and safeguard drivers Reuters reported on Thursday that the U. S. Department of Justice has begun a criminal investigation into Uber’s Greyball program, and that a Northern California grand jury had issued a subpoena to Uber concerning how the software tool functioned and where it was deployed. Portland began its own investigation of Greyball after the New York Times revealed its existence in March. Uber has shared some information with the city but has not turned over the Greyball software itself. In an interview on Friday, Portland Commissioner Dan Saltzman, who oversees the city’s transportation department, said his colleagues on the city council have pledged to support a subpoena against Uber, which will be voted on next week. If Uber does not comply, Portland could ultimately review its ability to operate in the city, Saltzman said. ”We are not ready to go there yet,” Saltzman said. In a statement, Uber’s general manager for Oregon Bryce Bennett said the company has ”fully cooperated” with Portland and provided relevant information to its investigation. The city said it found no evidence Uber used Greyball to avoid inspectors since Uber was allowed to operate there in 2015. Portland received its own subpoena from the Northern California grand jury for records relating to Uber’s activities, including emails between the city and the company or its representatives, according to a copy of the document reviewed by Reuters. The subpoena to Portland was issued on March 10, a week after the New York Times report. The Portland subpoena does not indicate what criminal laws are at issue in the probe. Likewise, Uber’s grand jury subpoena does not list any federal statutes that may have been violated, a source familiar with the document said. A subpoena from a grand jury is a request for documents or testimony concerning a potential crime. It does not, in itself, indicate wrongdoing or mean charges will be brought. In a statement, Saltzman said the city supports the federal investigation.  (Reporting by Dan Levine in San Francisco, editing by Peter Henderson and Cynthia Osterman) HONG KONG Tencent Holdings Ltd has shrugged off concerns that a move to limit play time for some users of its   ”Honour of Kings” game could hurt its bottom line, saying those targeted make up only a small portion of its overall user base. AMSTERDAM TomTom NV, the Dutch maker of navigation software for cars, on Wednesday said it had struck a deal with Chinese internet company Baidu to collaborate on digital maps used for   driving. ",0.0
"Disrupt Berlin 2018 early-bird prices extended – TechCrunch. It’s possible that St. Expeditus, the patron saint of procrastinators, has taken a shine to time-stressed startuppers. Call it whatever you like — divine intervention, planetary alignment or darned good luck — we’re extending the deadline for early-bird tickets to Disrupt Berlin 2018. That means you have 10 days until the 2 November deadline to save up to €500. Expedite your decision-making and buy your ticket today. Why wouldn’t you join thousands of your peers and colleagues for two full days devoted to all things startup? Disrupt Berlin draws an international audience — literally thousands of attendees from more than 50 countries, including all the European Union members, Turkey, Russia, Egypt, India, China, South Korea and the list goes on. It’s an opportunity to see some of the best technology the world has to offer — and connect with the people behind it. Take Startup Alley for example. More than 400 pre-Series A startups will populate our expo floor and showcase some pretty spectacular tech products, platforms, services and talent. It’s where innovation, collaboration and opportunity meet. And you won’t want to miss our curated cohort of startups that earned the coveted TC Top Pick designation. More than 40 exceptional startups span these tech categories: AI/Machine Learning, Blockchain, CRM/Enterprise, E-commerce, Education, Fintech, Healthtech/Biotech, Hardware, Robotics, IoT, Mobility and Gaming. Here are just a few: Here’s the complete list of TC Top Picks at Disrupt Berlin 2018. Disrupt Berlin 2018 offers an opportunity at every turn. Learn from our roster of outstanding speakers — leading founders, investors and technologists sharing their knowledge, perspective and advice. Take advantage of our Q&A Sessions to go deep on crucial tech topics with experts in a smaller, more intimate setting. Experience the thrill of Startup Battlefield, our epic pitch competition, as founders from 15 startups compete for the heralded Disrupt Cup, $50,000 cash and potentially life-changing media and investor love. Oh, and do not miss our kick-ass After Party. Want more specifics? Read the agenda. Disrupt Berlin 2018 takes place on 29-30 November. You have a little over an extra week to save up to €500. Don’t disappoint St. Expeditus — buy your pass before the 2 November deadline.",0.0
"Bernie Sanders: Bill Clinton’s Conduct with Women Was ’Deplorable’ - Breitbart. Democratic presidential candidate Sen. Bernie Sanders slammed Bill Clinton for his past “deplorable” behavior with women. [Sanders made the swipe at Sunday night’s Democratic debate in Charleston, South Carolina, hosted by the Black Congressional Caucus Institute. Hillary Clinton said that she will talk to Bill “at the kitchen table” and use him as a goodwill emissary for her White House.  NBC News moderator Andrea Mitchell asked Sanders about his recent assertion that Bill Clinton’s conduct during the Monica Lewinsky affair was “disgraceful. ” Mitchell asked Sanders if he regretted the comment and even went so far as to say that he did not have to answer the reporter’s question in that case. Sanders, yet again, attacked Bill Clinton while also simultaneously calling the question frivolous, which is a tactic that he has commonly used. “I was asked a question. You know one of the things, Andrea, and that question annoys me,” Sanders said. “I cannot walk down the street, and Secretary Clinton knows this, without somebody telling me how much I have to attack Secretary Clinton. ” Mitchell defended Clinton, saying that Sanders did not have to answer the question. “I was asked a question  …     If i don’t answer it then it’s another front page,” Sanders said. “Yes, his behavior, was deplorable. Have I ever said anything about that?” Sanders continued. Sanders’s “deplorable” comment, paired with his assertion that he never said anything about it, is a study in contradictions. Hillary, meanwhile, said that Bill Clinton will be used “as a good will emissary to go around the country to find the best ideas we’ve got. ” “It will start at the kitchen table, we’ll see where it goes from there,” Clinton said of her potential conversations with husband Bill in the White House.",1.0
"Bolivia suspends airline as Colombian crash probe points to lack of fuel.  Bolivian authorities on Thursday suspended the license of a tiny charter airline whose plane crashed in Colombia this week after apparently running out of fuel, killing 71 people and wiping out a Brazilian soccer team on its way to a regional cup final. Monday night’s disaster sent shock waves across the global soccer community and plunged Brazil, Latin America’s largest nation, into mourning. The small Chapecoense team was traveling on a charter flight operated by airline LAMIA Bolivia to the biggest game in its history, the final of the Copa Sudamericana. Investigators combing the crash site on a wooded hillside outside of Medellin found no traces of fuel in the wreckage of the BAe 146 made by Britain’s BAE Systems Plc, signaling that the crash may have resulted from lack of fuel.  International flight regulations require aircraft to carry enough reserve fuel to fly for 30 minutes after reaching their destination.  ”In this case, sadly, the aircraft did not have enough fuel to meet the regulations for contingency,” said Freddy Bonilla, secretary of airline security at Colombia’s aviation authority.    Bolivian authorities said they were suspending LAMIA’s operating license and replacing the management of its aviation authority to ensure a transparent investigation. It said that neither decision implied wrongdoing. Local media in Brazil, citing an internal document, reported an official at the Bolivian aviation agency called Celia Castedo raised concerns about LAMIA’s flight plan. The official urged the airline to come up with an alternative route because the 4 hour and 22 minute journey was the same length as the plane’s maximum flight range. The reports said the official, who could not be reached by Reuters for comment, did not have the power to stop the flight. A Colombian civil aviation document seen by Reuters confirmed the flight time was set to be 4 hours and 22 minutes. Medellin air traffic controllers asked the LAMIA pilot to wait while another flight made an emergency landing. Details on the length of the wait and problems with the other flight were not immediately available. Air traffic controller Yaneth Molina, who received the distress call, said in a letter written to colleagues that she had received death threats following the crash. ”I did all that was humanly possible and technically necessary to preserve the lives of the passengers, but unfortunately my efforts weren’t enough,” Molina wrote in her letter, which was later released to the press. A crackling recording obtained by Colombian media of Bolivian pilot Miguel Quiroga’s final words showed he told the control tower at Medellin’s airport that the plane was ”in total failure, total electrical failure, without fuel.”  He requested urgent permission to land, and then the audio went silent. LAMIA Chief Executive Officer Gustavo Vargas on Wednesday said the plane had been correctly inspected before departure and should have had enough fuel for about    hours. In such situations, it is at the pilot’s discretion whether to refuel, Vargas said.  Only 0. 5 percent of accidents on record were blamed on low fuel, according to the U. S.  Flight Safety Foundation. BRAZIL GRIEVES In the soccer club’s small farming hometown of Chapeco in southern Brazil, workers on Thursday erected temporary structures in the stadium to shelter the coffins of 51 victims   players, staff and journalists   expected to arrive back for an   wake on Saturday. Some 100, 000 fans, about half the city’s population, were expected to attend, as were Brazilian President Michel Temer and Gianni Infantino, president of world soccer governing body FIFA. On Wednesday night, when the Copa Sudamericana final had been scheduled, tens of thousands of fans assembled in tribute at Chapecoense’s arena and the stadium in Medellin of rival team Atletico Nacional.  ”We Brazilians will never forget the way in which Colombians have felt as their own the pain of this terrible disaster that ended the historic dream of Chapecoense,” Foreign Minister Jose Serra told the crowds in Medellin. Fox Sports Brasil, which lost six of its journalists in the crash, broadcast 90 minutes of a black screen in the time slot of Wednesday’s game. A spokesman for Britain’s Air Accidents Investigation Branch said an inspector for the agency and Colombian officials would transport the aircraft’s black boxes back to the United Kingdom, where the information will be downloaded. Only six on board the flight survived: three Chapecoense team members, a journalist and two Bolivian crew members. Some have wondered why Chapecoense used the charter company instead of a commercial airline. Club Vice President Luiz Antonio Palaoro said LAMIA had a track record of transporting soccer teams around South America, and it had used the airline before.  ”We are dealing with the humanitarian aspect of the families and the victims,” Palaoro told reporters in Chapeco. ”After that, we are going to have to think about restructuring the team and also the appropriate legal measures.” Among surviving players, goalkeeper Jackson Follmann’s right leg was amputated, while defender Helio Neto was in intensive care with severe trauma to his skull, thorax and lungs. Fellow defender Alan Ruschel had spinal surgery.  Two of the Bolivian flight crew, Ximena Suarez and Erwin Tumiri, were bruised but not in critical condition, while journalist Rafael Valmorbida was treated in intensive care for multiple rib fractures that partly collapsed a lung. Tumiri may soon be released, local press reported.  (Reporting by Daniel Ramos in La Paz, Brad Haynes in Chapeco, Anthony Boadle in Brasilia, Helen Murphy and Julia Symmes Cobb in Bogota and Tim Hepher in Paris; Writing by Helen Murphy in Bogota and Daniel Flynn in Sao Paulo; Editing by Jeffrey Benkoe, Lisa Von Ahn and Lisa Shumaker) QAMISHLI,   The head of the Syrian Kurdish YPG militia said on Wednesday that Turkish military deployments near   areas of northwestern Syria amounted to a ”declaration of war” which could trigger clashes within days. CARACAS   government supporters burst into Venezuela’s   congress on Wednesday, witnesses said, attacking and besieging lawmakers in the latest   of violence during a political crisis. ",0.0
"Juba Gripped by Renewed Violence as Factions Clash in South Sudan - The New York Times. JUBA, South Sudan  —   Armed clashes between two factions and waves of heavy gunfire spread across South Sudan’s capital on Sunday, a day after the nation’s fifth anniversary of its independence. Military helicopters swooped over the city, Juba, and armored vehicles rolled through streets, witnesses said. People took shelter in their homes and hid beneath their beds as the sounds of guns and heavier weapons rose, fell and rose again. “We are fighting at Gudele, Rock City and Jebel,” said William Gatjiath Deng, a spokesman for Vice President Riek Machar, referring to neighborhoods and suburbs of Juba. “There are a lot of bodies. I can’t even count them. ” Each side blamed the other for initiating the new outburst of violence. Michael Makuei, South Sudan’s information minister, said President Salva Kiir would soon declare a “unilateral  . ” The United Nations peacekeeping mission in the country wrote on Twitter that a “heavily armed exchange” had occurred near its base around 8:30 a. m. “The heavy artillery has been continuing since morning,” Shantal Persaud, a spokeswoman for the mission, said late Sunday afternoon. “The civilians have not been able to move from our accommodation” at the mission’s base near Jebel. Even as people sought refuge in their homes, witnesses reported that officers were knocking on doors in some neighborhoods, checking identity cards. The renewed violence broke a short and uneasy calm on Saturday, after fighting had erupted Friday. That violence is reported to have killed at least 150 people, with the toll expected to rise because casualties were still being counted. Factions of the South Sudanese Army loyal to Mr. Kiir and those backing Mr. Machar, who until this year led a rebellion against the government, have been fighting throughout the capital since Thursday, when the two sides confronted each other at a roadside checkpoint. Five government soldiers were killed in those exchanges. Fighting broke out again the next day as the two leaders were meeting. The United States said it had met with representatives of the South Sudanese leadership on Saturday and had received assurances that the fighting would stop. The United States helped engineer South Sudan’s independence from Sudan and still wields influence in the country. On Sunday, however, gunfire erupted again, spreading to different parts of the capital, including near the main army barracks and Juba International Airport. In New York, the United Nations Security Council scheduled an emergency meeting on Sunday afternoon to address the South Sudan crisis, the council announced on Twitter. In an email, J. Peter Pham, the director of the Africa Center at the Atlantic Council in Washington, said it was unclear how much sway Mr. Kiir and Mr. Machar and other faction leaders in the “  transition government” had over their fighters. “Between the collapse of oil prices and the destruction they themselves wrought in the civil war, South Sudan is so destitute that there are no resources with which the country’s rulers might employ to bring their followers to heel,” Mr. Pham said.",-1.0
"Celebrities getting political at the Oscars? Give them an award. Being both old enough and shallow enough to remember the once seemingly annual horror of Susan Sarandon and Tim Robbins’ political speeches at the Oscars, I understand why so many people experience a kind of inner death when celebrities heave themselves up on their political high horse at award ceremonies. From Vanessa Redgrave denouncing the Jewish Defense League as “Zionist hoodlums” in 1978 to Jared Leto giving a shout out to “all the dreamers  …     in the Ukraine and Venezuela” in 2014, the list of celebrities dabbling in politics at the Academy Awards is only slightly more impressive than Donald Trump’s movie cameos. So I get why people feel weary at best, disgust at worst about the inevitable   we’ll get at tomorrow night’s Oscars. Trump supporters will sneer at the    hysterical elitists who think they have a right to tell us normal folk what to do. As journalist (and daughter of John) Meghan McCain put it after the Golden Globes last month: “This Meryl Streep speech is why Trump won. And if people in Hollywood don’t start recognising why and how  —   you will help him get  . ” People voted Trump for lots of reasons but I don’t think a desire to stick it to Meryl Streep was one of them. Meanwhile liberals have been making similar arguments, if in less strident tones. They say that overpaid celebrities railing against the government will only turn the current political situation into an even bigger culture war: coastal elites versus   midwesterners. And that only helps Trump. Bipartisan as this take increasingly is, I don’t have much truck with it. Maybe it’s because there is something pretty hilarious about people saying celebrities shouldn’t talk about politics, when a celebrity is currently the president of the United States. The suggestion that actors are too privileged to talk to us ’umble,   peasants would work better if a Manhattan billionaire who lives in a literal golden palace hadn’t been elected on the basis that he really understands the average American. Celebrities are, after all, free citizens, and last time I checked, the US wasn’t a totalitarian state where criticism of our Dear Leader is forbidden on TV. But I’m guessing Steve Bannon is working on that. I am writing this from America, and, over here, President Trump is the only story in town. Whether people support or fear him, he is the first and last topic of conversation for pretty much everyone I’ve talked to over the past fortnight. For American celebrities not to acknowledge this would make them look a lot more cosseted by privilege than a dislike of the president. Yes, there will be total uniformity of political opinion at the Oscars: the awards take place in California, after all, a solidly Democrat state. And yes, the president can then spin that as proof of liberal elitism. But if everyone avoided doing things that might be reframed negatively by the president, they wouldn’t get out of bed in the morning. And some things are just plain wrong, whatever your politics: the president spreading false rumours about voter fraud and Swedish terror attacks the senate voting to defund Planned Parenthood, the primary health provider for many   women. So if Republican celebrities aren’t speaking up  —   Robert Duvall, say, or Adam Sandler  —   well, maybe they don’t fancy defending the indefensible. For every two celebrities (Viola Davis, Meryl Streep) who speak brilliantly about politics there will be at least 20 (Madonna, Tom Hiddleston) who put their gilded foot in it, which is pretty much the average ratio for humans in general. I’m OK with that. Everyone who feels strongly about these issues has a right to protest, and that includes gratingly   celebrities at massively   events. If you don’t want to hear celebrities wanging on, maybe just don’t watch the Oscars. I hear there are other TV channels out there. Celebrity protests rarely change things. After all, as President Trump and his supporters are keen to point out, all the celebrities in the world  —   and I mean that pretty much literally  —   couldn’t help Hillary Clinton get elected. But they certainly rattle the current president, a man so desperate to be recognised by Hollywood he insisted on appearing in Home Alone 2. Chipping away at his insatiably needy ego may well be one of the more powerful tools against him. For the first time in history, telling celebrities not to talk about politics sounds a lot less like sensible advice, and a lot more like a means of stifling powerful protest.",-0.5
